{
  "$schema": "../../schemas/pattern.schema.json",
  "id": "pat:diff-review-thread",
  "name": "差异行内评审线程 (Diff Review Thread)",
  "category": "feedback",
  "description": "在代码差异块上挂载行内评审评论线程：锚定行号、折叠回复、解决／重开状态与逐行归属色条。",
  "author": "Setup Center Design Lab",
  "tags": ["代码评审", "行内评论", "线程折叠", "解决状态"],
  "codeSnippet": "import { useState } from \"react\";\n\nexport type ReviewReply = { id: string; author: string; body: string };\n\nexport type DiffHunk = {\n  id: string;\n  lineNumber: number;\n  kind: \"add\" | \"del\" | \"context\";\n  text: string;\n  replies: ReviewReply[];\n};\n\nexport function DiffReviewThread({ hunk }: { hunk: DiffHunk }) {\n  const [resolved, setResolved] = useState(false);\n  const [collapsed, setCollapsed] = useState(false);\n  const [draft, setDraft] = useState(\"\");\n  const [replies, setReplies] = useState(hunk.replies);\n\n  const submit = () => {\n    const body = draft.trim();\n    if (!body) return;\n    setReplies((prev) => [\n      ...prev,\n      { id: String(prev.length + 1), author: \"you\", body },\n    ]);\n    setDraft(\"\");\n  };\n\n  return (\n    <div className=\"drt-root\" data-resolved={resolved}>\n      <div className=\"drt-code\" data-kind={hunk.kind}>\n        <span className=\"drt-gutter\">{hunk.lineNumber}</span>\n        <code className=\"drt-line\">\n          <span className=\"drt-sign\" aria-hidden=\"true\">\n            {hunk.kind === \"add\" ? \"+\" : hunk.kind === \"del\" ? \"-\" : \" \"}\n          </span>\n          {hunk.text}\n        </code>\n      </div>\n\n      <div className=\"drt-thread\">\n        <header className=\"drt-thread-head\">\n          <button type=\"button\" onClick={() => setCollapsed((v) => !v)}>\n            {collapsed ? \"▸\" : \"▾\"} {replies.length} comment\n            {replies.length === 1 ? \"\" : \"s\"}\n          </button>\n          <span className=\"drt-spacer\" />\n          <button type=\"button\" onClick={() => setResolved((v) => !v)}>\n            {resolved ? \"Reopen\" : \"Resolve\"}\n          </button>\n        </header>\n\n        {collapsed\n          ? null\n          : replies.map((reply) => (\n              <article className=\"drt-comment\" key={reply.id}>\n                <strong className=\"drt-author\">{reply.author}</strong>\n                <p className=\"drt-body\">{reply.body}</p>\n              </article>\n            ))}\n\n        {collapsed ? null : (\n          <div className=\"drt-composer\">\n            <textarea\n              value={draft}\n              onChange={(e) => setDraft(e.target.value)}\n              placeholder=\"Leave a review comment…\"\n              aria-label=\"New review comment\"\n            />\n            <button type=\"button\" onClick={submit} disabled={!draft.trim()}>\n              Comment\n            </button>\n          </div>\n        )}\n      </div>\n    </div>\n  );\n}",
  "cssRules": ".drt-root {\n  border: 1px solid var(--line-subtle, #e4e4e7);\n  border-radius: 8px;\n  overflow: hidden;\n  background: var(--surface-base, #ffffff);\n  font-size: 12px;\n}\n.drt-root[data-resolved=\"true\"] {\n  opacity: 0.62;\n}\n.drt-code {\n  display: flex;\n  gap: 10px;\n  padding: 6px 12px;\n  font-family: ui-monospace, SFMono-Regular, monospace;\n  border-left: 3px solid transparent;\n}\n.drt-code[data-kind='add'] {\n  background: rgba(34, 197, 94, 0.1);\n  border-left-color: #22c55e;\n}\n.drt-code[data-kind='del'] {\n  background: rgba(239, 68, 68, 0.1);\n  border-left-color: #ef4444;\n}\n.drt-gutter {\n  width: 34px;\n  text-align: right;\n  color: var(--text-muted, #a1a1aa);\n  user-select: none;\n}\n.drt-sign {\n  margin-right: 6px;\n  font-weight: 700;\n}\n.drt-thread {\n  padding: 10px 12px 12px;\n  border-top: 1px dashed var(--line-subtle, #e4e4e7);\n  background: var(--surface-inset, #fafafa);\n}\n.drt-thread-head {\n  display: flex;\n  align-items: center;\n  gap: 8px;\n}\n.drt-thread-head button {\n  font: inherit;\n  font-size: 11px;\n  padding: 2px 6px;\n  border-radius: 4px;\n  border: 1px solid var(--line-subtle, #e4e4e7);\n  background: var(--surface-base, #ffffff);\n  color: inherit;\n  cursor: pointer;\n}\n.drt-spacer {\n  flex: 1;\n}\n.drt-comment {\n  padding: 8px 0 0;\n}\n.drt-author {\n  display: block;\n  font-size: 11px;\n  color: var(--text-muted, #71717a);\n}\n.drt-body {\n  margin: 2px 0 0;\n  line-height: 1.55;\n}\n.drt-composer {\n  display: flex;\n  gap: 8px;\n  margin-top: 10px;\n}\n.drt-composer textarea {\n  flex: 1;\n  min-height: 48px;\n  padding: 6px 8px;\n  font: inherit;\n  resize: vertical;\n  border-radius: 6px;\n  border: 1px solid var(--line-subtle, #e4e4e7);\n  background: var(--surface-base, #ffffff);\n  color: inherit;\n}\n.drt-composer button {\n  align-self: flex-start;\n  padding: 6px 12px;\n  font: inherit;\n  border-radius: 6px;\n  border: none;\n  background: var(--accent, #18181b);\n  color: #ffffff;\n  cursor: pointer;\n}\n.drt-composer button:disabled {\n  opacity: 0.45;\n  cursor: not-allowed;\n}",
  "usage": "用于代码评审页面、配置变更审批与文档批注审阅流程。",
  "targetStyles": ["monochrome-research", "nordic-frost", "swiss-dark", "academic-lab"],
  "updatedAt": "2026-10-04"
}
