{
  "$schema": "../../schemas/pattern.schema.json",
  "id": "pat:empty-state-canvas",
  "name": "优雅空状态占位 (Empty State Canvas)",
  "category": "empty-state",
  "description": "无数据、搜索无匹配或收件箱清空时的引导占位设计，带有虚线轮廓、微淡图标与明确的引导行动按钮。",
  "author": "Setup Center Design Lab",
  "tags": ["空状态", "引导", "无数据", "去玩具化"],
  "codeSnippet": "<div class=\"empty-canvas\">\n  <div class=\"empty-icon\"><svg ...></svg></div>\n  <h4 class=\"empty-heading\">未检索到匹配的资源</h4>\n  <p class=\"empty-desc\">换一个关键词或按下快捷键重置筛选范围。</p>\n  <button class=\"empty-action\">清除筛选条件</button>\n</div>",
  "cssRules": ".empty-canvas {\n  display: flex;\n  flex-direction: column;\n  align-items: center;\n  justify-content: center;\n  padding: 48px 24px;\n  border: 1px dashed rgba(255, 255, 255, 0.15);\n  border-radius: 8px;\n  text-align: center;\n  background: rgba(255, 255, 255, 0.015);\n}\n.empty-icon {\n  width: 44px;\n  height: 44px;\n  color: #71717a;\n  margin-bottom: 12px;\n}\n.empty-heading {\n  font-size: 14px;\n  font-weight: 600;\n  color: #e4e4e7;\n  margin-bottom: 6px;\n}\n.empty-desc {\n  font-size: 12px;\n  color: #a1a1aa;\n  max-width: 320px;\n  line-height: 1.5;\n  margin-bottom: 16px;\n}\n.empty-action {\n  font-size: 12px;\n  padding: 6px 14px;\n  background: #27272a;\n  color: #f4f4f5;\n  border: 1px solid #3f3f46;\n  border-radius: 6px;\n  cursor: pointer;\n}",
  "usage": "用于书签收藏为空、搜索结果为零以及流转收件箱（Inbox）初始状态。",
  "targetStyles": ["japanese-editorial", "nordic-frost", "academic-lab"],
  "updatedAt": "2026-10-03"
}
