{
  "$schema": "../../schemas/pattern.schema.json",
  "id": "pat:knowledge-browser-wiki",
  "name": "知识库浏览视图 (Knowledge Browser)",
  "category": "navigation",
  "description": "由面包屑导航、目录侧栏、正文排版区与反向链接页脚组成的知识库阅读视图，适合长文档与术语互联。",
  "author": "Setup Center Design Lab",
  "tags": ["知识库", "面包屑", "目录导航", "反向链接"],
  "codeSnippet": "export type TocEntry = { id: string; label: string };\nexport type Backlink = { id: string; label: string };\n\nexport function KnowledgeBrowserWiki({\n  trail,\n  toc,\n  children,\n  backlinks = [],\n}: {\n  trail: string[];\n  toc: TocEntry[];\n  children: React.ReactNode;\n  backlinks?: Backlink[];\n}) {\n  return (\n    <div className=\"kbw-root\">\n      <nav className=\"kbw-breadcrumb\" aria-label=\"Breadcrumb\">\n        {trail.map((crumb, index) => (\n          <span key={crumb}>\n            {index > 0 ? <i aria-hidden=\"true\">/</i> : null}\n            {index === trail.length - 1 ? (\n              <strong aria-current=\"page\">{crumb}</strong>\n            ) : (\n              <a href={\"#\" + crumb.toLowerCase()}>{crumb}</a>\n            )}\n          </span>\n        ))}\n      </nav>\n\n      <div className=\"kbw-body\">\n        <aside className=\"kbw-toc\">\n          <p className=\"kbw-toc-title\">On this page</p>\n          <ul>\n            {toc.map((entry) => (\n              <li key={entry.id}>\n                <a href={\"#\" + entry.id}>{entry.label}</a>\n              </li>\n            ))}\n          </ul>\n        </aside>\n\n        <article className=\"kbw-prose\">\n          {children}\n\n          {backlinks.length > 0 ? (\n            <footer className=\"kbw-backlinks\">\n              <h4>Linked from</h4>\n              <ul>\n                {backlinks.map((link) => (\n                  <li key={link.id}>\n                    <a href={\"#\" + link.id}>{link.label}</a>\n                  </li>\n                ))}\n              </ul>\n            </footer>\n          ) : null}\n        </article>\n      </div>\n    </div>\n  );\n}",
  "cssRules": ".kbw-root {\n  max-width: 1100px;\n  margin: 0 auto;\n  padding: 24px;\n  background: var(--surface-base, #fdfcf9);\n  color: var(--text-strong, #1a1a1a);\n}\n.kbw-breadcrumb {\n  display: flex;\n  gap: 7px;\n  font-size: 11px;\n  text-transform: uppercase;\n  letter-spacing: 0.08em;\n  color: var(--text-muted, #6b7280);\n  padding-bottom: 12px;\n  border-bottom: 1px solid var(--line-subtle, #e4e4e7);\n}\n.kbw-breadcrumb i {\n  font-style: normal;\n  opacity: 0.5;\n  margin-right: 7px;\n}\n.kbw-breadcrumb a {\n  color: inherit;\n  text-decoration: none;\n}\n.kbw-breadcrumb a:hover {\n  text-decoration: underline;\n}\n.kbw-body {\n  display: grid;\n  grid-template-columns: 200px 1fr;\n  gap: 40px;\n  padding-top: 28px;\n}\n.kbw-toc {\n  position: sticky;\n  top: 24px;\n  align-self: start;\n  font-size: 11px;\n}\n.kbw-toc-title {\n  margin: 0 0 8px;\n  text-transform: uppercase;\n  letter-spacing: 0.1em;\n  color: var(--text-muted, #9ca3af);\n}\n.kbw-toc ul {\n  list-style: none;\n  margin: 0;\n  padding: 0;\n  border-left: 1px solid var(--line-subtle, #e4e4e7);\n}\n.kbw-toc li a {\n  display: block;\n  padding: 4px 0 4px 12px;\n  color: var(--text-muted, #52525b);\n  text-decoration: none;\n  border-left: 2px solid transparent;\n  margin-left: -1px;\n}\n.kbw-toc li a:hover {\n  color: var(--accent, #b91c1c);\n  border-left-color: var(--accent, #b91c1c);\n}\n.kbw-prose {\n  max-width: 68ch;\n  font-size: 15px;\n  line-height: 1.75;\n}\n.kbw-prose h2 {\n  margin: 2em 0 0.5em;\n  font-size: 22px;\n  letter-spacing: -0.01em;\n}\n.kbw-prose code {\n  font-family: ui-monospace, monospace;\n  font-size: 0.88em;\n  padding: 1px 5px;\n  border-radius: 4px;\n  background: var(--surface-inset, #f4f4f5);\n}\n.kbw-backlinks {\n  margin-top: 48px;\n  padding-top: 16px;\n  border-top: 1px solid var(--line-subtle, #e4e4e7);\n}\n.kbw-backlinks h4 {\n  margin: 0 0 8px;\n  font-size: 11px;\n  text-transform: uppercase;\n  letter-spacing: 0.1em;\n  color: var(--text-muted, #9ca3af);\n}\n.kbw-backlinks ul {\n  display: flex;\n  flex-wrap: wrap;\n  gap: 8px;\n  list-style: none;\n  margin: 0;\n  padding: 0;\n}\n.kbw-backlinks a {\n  display: inline-block;\n  padding: 3px 10px;\n  font-size: 12px;\n  border-radius: 999px;\n  border: 1px solid var(--line-subtle, #e4e4e7);\n  text-decoration: none;\n  color: inherit;\n}",
  "usage": "用于内部 Wiki、术语解释页、模式文档详读与学习资料阅读器。",
  "targetStyles": ["academic-lab", "japanese-editorial", "swiss-editorial", "monochrome-research"],
  "updatedAt": "2026-10-04"
}
