{
  "$schema": "../../schemas/pattern.schema.json",
  "id": "pat:activity-stream-live",
  "name": "实时活动事件流 (Live Activity Stream)",
  "category": "timeline",
  "description": "带级别过滤、来源徽标、相对时间与「新事件」分隔线的实时事件流，专为持续追加的日志与审计场景设计。",
  "author": "Setup Center Design Lab",
  "tags": ["实时流", "事件分级", "相对时间", "增量追加"],
  "codeSnippet": "import { useMemo, useState } from \"react\";\n\nexport type StreamEvent = {\n  id: string;\n  level: \"info\" | \"warn\" | \"error\";\n  source: string;\n  message: string;\n  at: number;\n};\n\nconst LEVELS = [\"info\", \"warn\", \"error\"] as const;\n\nexport function ActivityStreamLive({\n  events,\n  unseenFrom = 0,\n}: {\n  events: StreamEvent[];\n  unseenFrom?: number;\n}) {\n  const [levels, setLevels] = useState<string[]>([...LEVELS]);\n\n  const visible = useMemo(\n    () => events.filter((e) => levels.includes(e.level)),\n    [events, levels],\n  );\n\n  const toggle = (level: string) =>\n    setLevels((prev) =>\n      prev.includes(level) ? prev.filter((l) => l !== level) : [...prev, level],\n    );\n\n  const ago = (at: number) => {\n    const seconds = Math.max(0, Math.round((Date.now() - at) / 1000));\n    if (seconds < 60) return seconds + \"s ago\";\n    if (seconds < 3600) return Math.round(seconds / 60) + \"m ago\";\n    return Math.round(seconds / 3600) + \"h ago\";\n  };\n\n  return (\n    <div className=\"asl-root\">\n      <header className=\"asl-filter\">\n        {LEVELS.map((level) => (\n          <button\n            key={level}\n            type=\"button\"\n            aria-pressed={levels.includes(level)}\n            onClick={() => toggle(level)}\n            className=\"asl-chip\"\n            data-level={level}\n          >\n            {level}\n          </button>\n        ))}\n      </header>\n\n      <ol className=\"asl-list\">\n        {visible.map((event, index) => (\n          <li key={event.id}>\n            {index === unseenFrom ? (\n              <div className=\"asl-divider\" role=\"separator\">\n                new events\n              </div>\n            ) : null}\n            <article className=\"asl-event\" data-level={event.level}>\n              <span className=\"asl-level\" aria-hidden=\"true\" />\n              <span className=\"asl-source\">{event.source}</span>\n              <p className=\"asl-message\">{event.message}</p>\n              <time className=\"asl-time\" dateTime={new Date(event.at).toISOString()}>\n                {ago(event.at)}\n              </time>\n            </article>\n          </li>\n        ))}\n      </ol>\n    </div>\n  );\n}",
  "cssRules": ".asl-root {\n  display: flex;\n  flex-direction: column;\n  max-height: 520px;\n  background: var(--surface-inset, #0c0e13);\n  border: 1px solid var(--line-subtle, #1e2230);\n  border-radius: 10px;\n  overflow: hidden;\n  font-size: 12px;\n  color: var(--text-strong, #e2e8f0);\n  --level-info: #38bdf8;\n  --level-warn: #fbbf24;\n  --level-error: #f87171;\n}\n.asl-filter {\n  display: flex;\n  gap: 6px;\n  padding: 8px 10px;\n  border-bottom: 1px solid var(--line-subtle, #1e2230);\n}\n.asl-chip {\n  padding: 2px 9px;\n  font: inherit;\n  font-size: 10px;\n  text-transform: uppercase;\n  letter-spacing: 0.06em;\n  border-radius: 999px;\n  border: 1px solid var(--line-strong, #334155);\n  background: transparent;\n  color: var(--text-muted, #94a3b8);\n  cursor: pointer;\n}\n.asl-chip[aria-pressed=\"true\"] {\n  color: var(--text-strong, #ffffff);\n  border-color: currentColor;\n}\n.asl-chip[data-level=\"error\"][aria-pressed=\"true\"] { color: var(--level-error); }\n.asl-chip[data-level=\"warn\"][aria-pressed=\"true\"] { color: var(--level-warn); }\n.asl-chip[data-level=\"info\"][aria-pressed=\"true\"] { color: var(--level-info); }\n.asl-list {\n  list-style: none;\n  margin: 0;\n  padding: 0;\n  overflow-y: auto;\n}\n.asl-divider {\n  position: sticky;\n  top: 0;\n  padding: 3px 10px;\n  font-size: 10px;\n  text-transform: uppercase;\n  letter-spacing: 0.1em;\n  background: var(--accent, #6366f1);\n  color: #ffffff;\n}\n.asl-event {\n  display: grid;\n  grid-template-columns: 6px 78px 1fr auto;\n  align-items: baseline;\n  gap: 10px;\n  padding: 7px 12px;\n  border-bottom: 1px solid var(--line-subtle, #171c26);\n}\n.asl-event:hover {\n  background: rgba(255, 255, 255, 0.03);\n}\n.asl-level {\n  width: 6px;\n  height: 6px;\n  border-radius: 50%;\n  background: var(--level-info);\n}\n.asl-event[data-level='warn'] .asl-level { background: var(--level-warn); }\n.asl-event[data-level='error'] .asl-level { background: var(--level-error); }\n.asl-source {\n  font-family: ui-monospace, monospace;\n  font-size: 11px;\n  color: var(--text-muted, #94a3b8);\n  overflow: hidden;\n  text-overflow: ellipsis;\n}\n.asl-message {\n  margin: 0;\n  line-height: 1.5;\n  word-break: break-word;\n}\n.asl-time {\n  font-size: 10px;\n  color: var(--text-muted, #64748b);\n  white-space: nowrap;\n}",
  "usage": "用于后台任务监控、部署流水线实时输出与协作空间动态墙。",
  "targetStyles": ["swiss-dark", "dos-utility", "monochrome-research", "nordic-frost"],
  "updatedAt": "2026-10-04"
}
