{
  "$schema": "../../schemas/pattern.schema.json",
  "id": "pat:metric-stat-counter",
  "name": "指标统计卡片 (Metric Stat Counter)",
  "category": "dashboard",
  "description": "用于仪表盘与总览页的高信息密度数值展示卡片，包含大号等宽数字、趋势徽章与辅助说明文本。",
  "author": "Setup Center Design Lab",
  "tags": ["数据统计", "仪表盘", "大字阶", "高密度"],
  "codeSnippet": "<div class=\"stat-card\">\n  <div class=\"stat-label\">收录样式总数</div>\n  <div class=\"stat-value\">20 <span class=\"stat-badge\">+8 新增</span></div>\n  <div class=\"stat-sub\">覆盖和风、赛博、极简等主流设计语言</div>\n</div>",
  "cssRules": ".stat-card {\n  background: #12141a;\n  border: 1px solid #232733;\n  border-radius: 8px;\n  padding: 16px;\n}\n.stat-label {\n  font-size: 12px;\n  color: #8f96a3;\n  text-transform: uppercase;\n  letter-spacing: 0.05em;\n}\n.stat-value {\n  font-size: 28px;\n  font-weight: 700;\n  font-family: ui-monospace, monospace;\n  color: #ffffff;\n  margin: 6px 0;\n  display: flex;\n  align-items: baseline;\n  gap: 8px;\n}\n.stat-badge {\n  font-size: 11px;\n  padding: 2px 6px;\n  border-radius: 4px;\n  background: rgba(34, 197, 94, 0.15);\n  color: #4ade80;\n  border: 1px solid rgba(34, 197, 94, 0.3);\n}\n.stat-sub {\n  font-size: 11px;\n  color: #636b7b;\n}",
  "usage": "用于首页总览屏统计、Vault 资源库规模指标及硬件参数探测总结面板。",
  "targetStyles": ["financial-terminal", "swiss-dark", "academic-lab"],
  "updatedAt": "2026-10-03"
}
