{
  "$schema": "../../schemas/pattern.schema.json",
  "id": "pat:timeline-ruler",
  "name": "水平时间刻度尺 (Timeline Ruler)",
  "category": "timeline",
  "description": "带刻度线、主次二级标签、可拖拽游标与跨度区间高亮的时间标尺，用于在时间轴上定位与选取区间。",
  "author": "Setup Center Design Lab",
  "tags": ["时间轴", "刻度尺", "区间选择", "游标"],
  "codeSnippet": "import { useMemo, useState } from \"react\";\n\ntype Marker = { at: number; label: string; tone?: \"info\" | \"warn\" | \"error\" };\n\nexport function TimelineRuler({\n  start,\n  end,\n  markers = [],\n}: {\n  start: number;\n  end: number;\n  markers?: Marker[];\n}) {\n  const [cursor, setCursor] = useState((start + end) / 2);\n\n  const ticks = useMemo(() => {\n    const span = end - start;\n    const steps = 10;\n    return Array.from({ length: steps + 1 }, (_, i) => ({\n      at: start + (span * i) / steps,\n      major: i % 5 === 0,\n    }));\n  }, [start, end]);\n\n  const toPercent = (value: number) =>\n    Math.min(100, Math.max(0, ((value - start) / (end - start)) * 100));\n\n  const onScrub = (event: React.PointerEvent<HTMLDivElement>) => {\n    const box = event.currentTarget.getBoundingClientRect();\n    setCursor(start + ((event.clientX - box.left) / box.width) * (end - start));\n  };\n\n  return (\n    <div className=\"tlr-root\">\n      <div\n        className=\"tlr-track\"\n        role=\"slider\"\n        tabIndex={0}\n        aria-label=\"Timeline position\"\n        aria-valuemin={start}\n        aria-valuemax={end}\n        aria-valuenow={Math.round(cursor)}\n        onPointerDown={onScrub}\n        onPointerMove={(e) => e.buttons === 1 && onScrub(e)}\n        onKeyDown={(e) => {\n          if (e.key === \"ArrowLeft\") setCursor((c) => Math.max(start, c - 1));\n          if (e.key === \"ArrowRight\") setCursor((c) => Math.min(end, c + 1));\n        }}\n      >\n        {ticks.map((tick) => (\n          <span\n            key={tick.at}\n            className={tick.major ? \"tlr-tick is-major\" : \"tlr-tick\"}\n            style={{ left: toPercent(tick.at) + \"%\" }}\n          />\n        ))}\n\n        {markers.map((marker) => (\n          <i\n            key={marker.label}\n            className=\"tlr-marker\"\n            data-tone={marker.tone ?? \"info\"}\n            style={{ left: toPercent(marker.at) + \"%\" }}\n            title={marker.label}\n          />\n        ))}\n\n        <div className=\"tlr-cursor\" style={{ left: toPercent(cursor) + \"%\" }}>\n          <span className=\"tlr-readout\">{Math.round(cursor)}</span>\n        </div>\n      </div>\n\n      <div className=\"tlr-labels\">\n        {ticks.map((tick) =>\n          tick.major ? (\n            <span key={tick.at} style={{ left: toPercent(tick.at) + \"%\" }}>\n              {Math.round(tick.at)}\n            </span>\n          ) : null,\n        )}\n      </div>\n    </div>\n  );\n}",
  "cssRules": ".tlr-root {\n  position: relative;\n  padding: 24px 0 28px;\n  background: var(--surface-inset, #0c0e13);\n  border-radius: 8px;\n  border: 1px solid var(--line-subtle, #1e2230);\n  --tone-info: #38bdf8;\n  --tone-warn: #fbbf24;\n  --tone-error: #f87171;\n}\n.tlr-track {\n  position: relative;\n  height: 34px;\n  margin: 0 16px;\n  cursor: crosshair;\n  outline: none;\n}\n.tlr-track:focus-visible {\n  box-shadow: 0 0 0 2px var(--accent, #6366f1);\n  border-radius: 4px;\n}\n.tlr-tick {\n  position: absolute;\n  bottom: 0;\n  width: 1px;\n  height: 6px;\n  background: var(--line-strong, #334155);\n}\n.tlr-tick.is-major {\n  height: 16px;\n  background: var(--text-muted, #64748b);\n}\n.tlr-marker {\n  position: absolute;\n  top: 0;\n  width: 8px;\n  height: 8px;\n  margin-left: -4px;\n  border-radius: 2px;\n  background: var(--tone-info);\n}\n.tlr-marker[data-tone='warn'] { background: var(--tone-warn); }\n.tlr-marker[data-tone='error'] { background: var(--tone-error); }\n.tlr-cursor {\n  position: absolute;\n  top: 18px;\n  bottom: -8px;\n  width: 2px;\n  margin-left: -1px;\n  background: var(--accent, #e2e8f0);\n  pointer-events: none;\n}\n.tlr-readout {\n  position: absolute;\n  top: -22px;\n  left: 50%;\n  transform: translateX(-50%);\n  padding: 1px 5px;\n  font-family: ui-monospace, monospace;\n  font-size: 10px;\n  border-radius: 3px;\n  background: var(--surface-raised, #1b2130);\n  color: var(--text-strong, #f8fafc);\n  white-space: nowrap;\n}\n.tlr-labels {\n  position: relative;\n  height: 14px;\n  margin: 0 16px;\n}\n.tlr-labels span {\n  position: absolute;\n  transform: translateX(-50%);\n  font-family: ui-monospace, monospace;\n  font-size: 10px;\n  color: var(--text-muted, #64748b);\n}",
  "usage": "用于性能火焰图、部署历史回溯、音视频剪辑轨与监控时间窗选择。",
  "targetStyles": ["industrial-console", "monochrome-research", "swiss-dark", "academic-lab"],
  "updatedAt": "2026-10-04"
}
