{
  "$schema": "../../schemas/pattern.schema.json",
  "id": "pat:inspector-panel",
  "name": "属性检查器面板 (Inspector Panel)",
  "category": "inspector",
  "description": "按语义分组展示选中对象全部可编辑属性的侧栏检查器，支持分段、切换、数值步进与只读元数据行。",
  "author": "Setup Center Design Lab",
  "tags": ["属性检查器", "表单分组", "元数据", "设计工具"],
  "codeSnippet": "import { useState } from \"react\";\n\ntype Field =\n  | { kind: \"text\"; key: string; label: string; value: string }\n  | { kind: \"number\"; key: string; label: string; value: number; min?: number; max?: number; step?: number }\n  | { kind: \"toggle\"; key: string; label: string; value: boolean }\n  | { kind: \"readonly\"; key: string; label: string; value: string };\n\ntype Group = { title: string; fields: Field[] };\n\nexport function InspectorPanel({ groups }: { groups: Group[] }) {\n  const [draft, setDraft] = useState(() =>\n    Object.fromEntries(\n      groups.flatMap((g) => g.fields).map((f) => [f.key, f.value]),\n    ) as Record<string, string | number | boolean>,\n  );\n\n  const set = (key: string, value: string | number | boolean) =>\n    setDraft((prev) => ({ ...prev, [key]: value }));\n\n  return (\n    <div className=\"insp-root\">\n      <header className=\"insp-head\">\n        <span className=\"insp-eyebrow\">Selection</span>\n        <strong>1 object</strong>\n      </header>\n\n      {groups.map((group) => (\n        <section className=\"insp-group\" key={group.title}>\n          <h4 className=\"insp-group-title\">{group.title}</h4>\n          {group.fields.map((field) => (\n            <div className=\"insp-row\" key={field.key}>\n              <label className=\"insp-label\" htmlFor={field.key}>\n                {field.label}\n              </label>\n\n              {field.kind === \"readonly\" ? (\n                <span className=\"insp-value-readonly\">{String(draft[field.key])}</span>\n              ) : field.kind === \"toggle\" ? (\n                <input\n                  id={field.key}\n                  type=\"checkbox\"\n                  checked={Boolean(draft[field.key])}\n                  onChange={(e) => set(field.key, e.target.checked)}\n                />\n              ) : field.kind === \"number\" ? (\n                <input\n                  id={field.key}\n                  type=\"number\"\n                  value={Number(draft[field.key])}\n                  min={field.min}\n                  max={field.max}\n                  step={field.step ?? 1}\n                  onChange={(e) => set(field.key, Number(e.target.value))}\n                />\n              ) : (\n                <input\n                  id={field.key}\n                  type=\"text\"\n                  value={String(draft[field.key])}\n                  onChange={(e) => set(field.key, e.target.value)}\n                />\n              )}\n            </div>\n          ))}\n        </section>\n      ))}\n    </div>\n  );\n}",
  "cssRules": ".insp-root {\n  width: 280px;\n  height: 100%;\n  overflow-y: auto;\n  padding: 16px;\n  background: var(--surface-base, #ffffff);\n  border-left: 1px solid var(--line-subtle, #e6e7eb);\n  color: var(--text-strong, #17181c);\n  font-size: 12px;\n}\n.insp-head {\n  display: flex;\n  flex-direction: column;\n  gap: 2px;\n  padding-bottom: 12px;\n  border-bottom: 1px solid var(--line-subtle, #e6e7eb);\n}\n.insp-eyebrow {\n  font-size: 10px;\n  text-transform: uppercase;\n  letter-spacing: 0.08em;\n  color: var(--text-muted, #6b7280);\n}\n.insp-group {\n  padding: 12px 0;\n  border-bottom: 1px solid var(--line-subtle, #e6e7eb);\n}\n.insp-group-title {\n  margin: 0 0 8px;\n  font-size: 10px;\n  font-weight: 600;\n  text-transform: uppercase;\n  letter-spacing: 0.08em;\n  color: var(--text-muted, #6b7280);\n}\n.insp-row {\n  display: grid;\n  grid-template-columns: 88px 1fr;\n  align-items: center;\n  gap: 8px;\n  padding: 3px 0;\n}\n.insp-label {\n  color: var(--text-muted, #6b7280);\n  overflow: hidden;\n  text-overflow: ellipsis;\n  white-space: nowrap;\n}\n.insp-row input[type='text'],\n.insp-row input[type='number'] {\n  width: 100%;\n  padding: 4px 6px;\n  font: inherit;\n  border-radius: 5px;\n  border: 1px solid var(--line-subtle, #e6e7eb);\n  background: var(--surface-inset, #fafafa);\n  color: inherit;\n}\n.insp-row input:focus-visible {\n  outline: 2px solid var(--accent, #4f46e5);\n  outline-offset: 1px;\n}\n.insp-value-readonly {\n  font-family: ui-monospace, monospace;\n  font-size: 11px;\n  color: var(--text-muted, #6b7280);\n  overflow: hidden;\n  text-overflow: ellipsis;\n  white-space: nowrap;\n}",
  "usage": "用于设计工具属性栏、选中节点配置面板与对象详情编辑区。",
  "targetStyles": ["soft-product-minimal", "spatial-glass", "nordic-frost", "swiss-editorial"],
  "updatedAt": "2026-10-04"
}
