{
  "$schema": "../../schemas/pattern.schema.json",
  "id": "pat:graph-canvas-network",
  "name": "关系图谱画布 (Graph Canvas Network)",
  "category": "dashboard",
  "description": "以 SVG 力导向布局渲染节点与连边的关系画布，支持节点拖拽、选中高亮与邻接关系弱化。",
  "author": "Setup Center Design Lab",
  "tags": ["关系图谱", "力导向布局", "SVG连线", "邻接高亮"],
  "codeSnippet": "import { useMemo, useRef, useState } from \"react\";\n\nexport type GraphNode = { id: string; label: string; x: number; y: number };\nexport type GraphEdge = { from: string; to: string };\n\nexport function GraphCanvasNetwork({\n  nodes,\n  edges,\n  width = 640,\n  height = 400,\n  radius = 18,\n}: {\n  nodes: GraphNode[];\n  edges: GraphEdge[];\n  width?: number;\n  height?: number;\n  radius?: number;\n}) {\n  const [positions, setPositions] = useState(() =>\n    Object.fromEntries(nodes.map((n) => [n.id, { x: n.x, y: n.y }])),\n  );\n  const [selected, setSelected] = useState<string | null>(null);\n  const dragRef = useRef<string | null>(null);\n  const svgRef = useRef<SVGSVGElement>(null);\n\n  const neighbours = useMemo(() => {\n    if (!selected) return new Set<string>();\n    const set = new Set<string>([selected]);\n    for (const edge of edges) {\n      if (edge.from === selected) set.add(edge.to);\n      if (edge.to === selected) set.add(edge.from);\n    }\n    return set;\n  }, [edges, selected]);\n\n  const move = (event: React.PointerEvent<SVGSVGElement>) => {\n    const id = dragRef.current;\n    const svg = svgRef.current;\n    if (!id || !svg) return;\n    const box = svg.getBoundingClientRect();\n    const x = ((event.clientX - box.left) / box.width) * width;\n    const y = ((event.clientY - box.top) / box.height) * height;\n    setPositions((prev) => ({ ...prev, [id]: { x, y } }));\n  };\n\n  return (\n    <svg\n      ref={svgRef}\n      className=\"gcn-root\"\n      viewBox={\"0 0 \" + width + \" \" + height}\n      role=\"img\"\n      aria-label=\"Dependency graph\"\n      onPointerMove={move}\n      onPointerUp={() => (dragRef.current = null)}\n      onPointerLeave={() => (dragRef.current = null)}\n    >\n      <g className=\"gcn-edges\">\n        {edges.map((edge) => {\n          const a = positions[edge.from];\n          const b = positions[edge.to];\n          if (!a || !b) return null;\n          const dim =\n            selected !== null &&\n            (!neighbours.has(edge.from) || !neighbours.has(edge.to));\n          return (\n            <line\n              key={edge.from + \"->\" + edge.to}\n              x1={a.x}\n              y1={a.y}\n              x2={b.x}\n              y2={b.y}\n              data-dim={dim}\n            />\n          );\n        })}\n      </g>\n\n      <g className=\"gcn-nodes\">\n        {nodes.map((node) => {\n          const pos = positions[node.id] ?? { x: node.x, y: node.y };\n          const dim = selected !== null && !neighbours.has(node.id);\n          return (\n            <g\n              key={node.id}\n              className=\"gcn-node\"\n              data-selected={node.id === selected}\n              data-dim={dim}\n              onPointerDown={() => {\n                dragRef.current = node.id;\n                setSelected(node.id);\n              }}\n            >\n              <circle cx={pos.x} cy={pos.y} r={radius} />\n              <text x={pos.x} y={pos.y + radius + 13} textAnchor=\"middle\">\n                {node.label}\n              </text>\n            </g>\n          );\n        })}\n      </g>\n    </svg>\n  );\n}",
  "cssRules": ".gcn-root {\n  width: 100%;\n  height: auto;\n  display: block;\n  background: var(--surface-inset, #0a0b10);\n  border: 1px solid var(--line-subtle, #1e2230);\n  border-radius: 10px;\n  touch-action: none;\n  background-image: radial-gradient(\n    var(--line-subtle, #1e2230) 1px,\n    transparent 1px\n  );\n  background-size: 24px 24px;\n}\n.gcn-edges line {\n  stroke: var(--line-strong, #334155);\n  stroke-width: 1.2;\n  transition: opacity 0.15s ease, stroke 0.15s ease;\n}\n.gcn-edges line[data-dim='true'] {\n  opacity: 0.18;\n}\n.gcn-node {\n  cursor: grab;\n}\n.gcn-node circle {\n  fill: var(--surface-raised, #171c26);\n  stroke: var(--accent, #6366f1);\n  stroke-width: 1.5;\n  transition: opacity 0.15s ease, transform 0.15s ease;\n}\n.gcn-node[data-selected='true'] circle {\n  fill: var(--accent, #6366f1);\n  stroke: #ffffff;\n  stroke-width: 2;\n}\n.gcn-node[data-dim='true'] circle {\n  opacity: 0.24;\n}\n.gcn-node text {\n  font-family: ui-sans-serif, system-ui, sans-serif;\n  font-size: 10px;\n  fill: var(--text-muted, #94a3b8);\n  user-select: none;\n}\n.gcn-node[data-dim='true'] text {\n  opacity: 0.3;\n}",
  "usage": "用于依赖关系图、知识图谱浏览模块与模块耦合可视化。",
  "targetStyles": ["cyber-neon", "swiss-dark", "blueprint", "academic-lab"],
  "updatedAt": "2026-10-04"
}
