{
  "$schema": "../../schemas/pattern.schema.json",
  "id": "pat:editorial-index-page",
  "name": "排印字母索引页 (Editorial Index Page)",
  "category": "navigation",
  "description": "以巨型字母分节、粘性字母头与密集多栏条目组成的书刊式索引页，适合超大目录的可扫读浏览。",
  "author": "Setup Center Design Lab",
  "tags": ["字母索引", "多栏排印", "粘性标题", "书刊式"],
  "codeSnippet": "import { useMemo } from \"react\";\n\nexport type IndexEntry = { id: string; term: string; note?: string };\n\nexport function EditorialIndexPage({\n  entries,\n  onOpen,\n}: {\n  entries: IndexEntry[];\n  onOpen?: (id: string) => void;\n}) {\n  const sections = useMemo(() => {\n    const buckets = new Map<string, IndexEntry[]>();\n    for (const entry of [...entries].sort((a, b) => a.term.localeCompare(b.term))) {\n      const letter = entry.term[0]?.toUpperCase() ?? \"#\";\n      const key = /[A-Z]/.test(letter) ? letter : \"#\";\n      const bucket = buckets.get(key) ?? [];\n      bucket.push(entry);\n      buckets.set(key, bucket);\n    }\n    return [...buckets.entries()].sort(([a], [b]) => a.localeCompare(b));\n  }, [entries]);\n\n  return (\n    <div className=\"eidx-root\">\n      <nav className=\"eidx-jump\" aria-label=\"Alphabet jump\">\n        {sections.map(([letter]) => (\n          <a key={letter} href={`#idx-${letter}`} className=\"eidx-jump-link\">\n            {letter}\n          </a>\n        ))}\n      </nav>\n\n      {sections.map(([letter, items]) => (\n        <section className=\"eidx-section\" key={letter}>\n          <h3 className=\"eidx-letter\" id={`idx-${letter}`}>\n            {letter}\n          </h3>\n          <ul className=\"eidx-list\">\n            {items.map((entry) => (\n              <li className=\"eidx-item\" key={entry.id}>\n                <button type=\"button\" onClick={() => onOpen?.(entry.id)}>\n                  <span className=\"eidx-term\">{entry.term}</span>\n                  {entry.note ? <span className=\"eidx-note\">{entry.note}</span> : null}\n                </button>\n              </li>\n            ))}\n          </ul>\n        </section>\n      ))}\n    </div>\n  );\n}",
  "cssRules": ".eidx-root {\n  max-width: 1080px;\n  margin: 0 auto;\n  padding: 32px 24px 64px;\n  font-family: 'Source Han Serif', Georgia, serif;\n  color: var(--text-strong, #141414);\n  background: var(--surface-base, #fdfcf9);\n}\n.eidx-jump {\n  position: sticky;\n  top: 0;\n  z-index: 2;\n  display: flex;\n  flex-wrap: wrap;\n  gap: 4px;\n  padding: 10px 0;\n  background: inherit;\n  border-bottom: 2px solid var(--line-strong, #141414);\n}\n.eidx-jump-link {\n  min-width: 22px;\n  text-align: center;\n  font-size: 11px;\n  letter-spacing: 0.06em;\n  text-decoration: none;\n  color: var(--text-muted, #52525b);\n}\n.eidx-jump-link:hover {\n  color: var(--accent, #b91c1c);\n}\n.eidx-section {\n  display: grid;\n  grid-template-columns: 96px 1fr;\n  gap: 24px;\n  padding: 24px 0;\n  border-bottom: 1px solid var(--line-subtle, #e4e4e7);\n}\n.eidx-letter {\n  position: sticky;\n  top: 64px;\n  align-self: start;\n  margin: 0;\n  font-size: 56px;\n  line-height: 1;\n  font-weight: 700;\n}\n.eidx-list {\n  columns: 3 220px;\n  column-gap: 32px;\n  margin: 0;\n  padding: 0;\n  list-style: none;\n}\n.eidx-item {\n  break-inside: avoid;\n  margin-bottom: 8px;\n}\n.eidx-item button {\n  display: flex;\n  flex-direction: column;\n  align-items: flex-start;\n  gap: 1px;\n  width: 100%;\n  padding: 0;\n  text-align: left;\n  border: none;\n  background: none;\n  font: inherit;\n  color: inherit;\n  cursor: pointer;\n}\n.eidx-term {\n  font-size: 14px;\n}\n.eidx-item button:hover .eidx-term {\n  text-decoration: underline;\n  text-underline-offset: 3px;\n}\n.eidx-note {\n  font-size: 11px;\n  color: var(--text-muted, #71717a);\n}",
  "usage": "用于术语表、资源总目录、字体／图标库检索页与文档附录。",
  "targetStyles": ["swiss-editorial", "newspaper-editorial", "japanese-editorial", "academic-lab"],
  "updatedAt": "2026-10-04"
}
