{
  "$schema": "../../schemas/pattern.schema.json",
  "id": "pat:desktop-window-frame",
  "name": "桌面窗口边框 (Desktop Window Frame)",
  "category": "layout",
  "description": "模拟原生桌面窗口的标题栏、窗口控件、边框焦点环与内容区的可复用外框，用于在 Web 中承载伪窗口面板。",
  "author": "Setup Center Design Lab",
  "tags": ["窗口隐喻", "标题栏", "焦点环", "桌面系统"],
  "codeSnippet": "import { useState, type ReactNode } from \"react\";\n\nexport function DesktopWindowFrame({\n  title,\n  children,\n  controls = [\"close\", \"minimize\", \"zoom\"] as const,\n  initialActive = false,\n}: {\n  title: string;\n  children: ReactNode;\n  controls?: readonly (\"close\" | \"minimize\" | \"zoom\")[];\n  initialActive?: boolean;\n}) {\n  const [active, setActive] = useState(initialActive);\n  const [minimized, setMinimized] = useState(false);\n\n  return (\n    <section\n      className=\"dwin\"\n      data-active={active}\n      onPointerDownCapture={() => setActive(true)}\n      onFocusCapture={() => setActive(true)}\n    >\n      <header className=\"dwin-bar\">\n        <div className=\"dwin-controls\">\n          {controls.map((control) => (\n            <button\n              key={control}\n              type=\"button\"\n              aria-label={control}\n              data-control={control}\n              className=\"dwin-control\"\n              onClick={() => {\n                if (control === \"minimize\") setMinimized((v) => !v);\n                if (control === \"close\") setActive(false);\n              }}\n            />\n          ))}\n        </div>\n        <h3 className=\"dwin-title\">{title}</h3>\n      </header>\n\n      {minimized ? null : <div className=\"dwin-body\">{children}</div>}\n    </section>\n  );\n}",
  "cssRules": ".dwin {\n  display: flex;\n  flex-direction: column;\n  min-width: 280px;\n  border-radius: 10px;\n  overflow: hidden;\n  background: var(--surface-raised, #ffffff);\n  border: 1px solid var(--line-subtle, #d4d4d8);\n  box-shadow: 0 1px 2px rgba(0, 0, 0, 0.08);\n  transition: box-shadow 0.15s ease;\n}\n.dwin[data-active=\"true\"] {\n  box-shadow: 0 16px 40px rgba(0, 0, 0, 0.24);\n  border-color: var(--line-strong, #a1a1aa);\n}\n.dwin-bar {\n  position: relative;\n  display: flex;\n  align-items: center;\n  justify-content: center;\n  height: 32px;\n  padding: 0 10px;\n  background: var(--surface-inset, #f4f4f5);\n  border-bottom: 1px solid var(--line-subtle, #d4d4d8);\n  user-select: none;\n}\n.dwin-controls {\n  position: absolute;\n  left: 10px;\n  display: flex;\n  gap: 6px;\n}\n.dwin-control {\n  width: 11px;\n  height: 11px;\n  padding: 0;\n  border-radius: 50%;\n  border: 1px solid rgba(0, 0, 0, 0.14);\n  background: #d4d4d8;\n  cursor: pointer;\n}\n.dwin-control[data-control='close'] { background: #ff5f57; }\n.dwin-control[data-control='minimize'] { background: #febc2e; }\n.dwin-control[data-control='zoom'] { background: #28c840; }\n.dwin-control:focus-visible {\n  outline: 2px solid var(--accent, #6366f1);\n  outline-offset: 2px;\n}\n.dwin-title {\n  margin: 0;\n  font-size: 12px;\n  font-weight: 500;\n  color: var(--text-muted, #52525b);\n}\n.dwin-body {\n  flex: 1;\n  padding: 16px;\n  overflow: auto;\n  font-size: 13px;\n  color: var(--text-strong, #18181b);\n}",
  "usage": "用于产品展示中的窗口拼贴、多窗口工作台与拖拽式浮层容器。",
  "targetStyles": ["retro-mac", "bauhaus", "neo-brutalism", "default"],
  "updatedAt": "2026-10-04"
}
