{
  "$schema": "../../schemas/pattern.schema.json",
  "id": "pat:ide-layout",
  "name": "集成开发环境三区布局 (IDE Layout)",
  "category": "layout",
  "description": "完整的 IDE 骨架：细窄活动栏、可折叠资源侧栏、带标签页的编辑主区与底部输出面板，适合承载高密度工程信息。",
  "author": "Setup Center Design Lab",
  "tags": ["IDE布局", "多面板", "标签页", "工程化"],
  "codeSnippet": "import { useState, type ReactNode } from \"react\";\n\ntype PanelTab = { id: string; label: string; content: ReactNode };\n\nexport function IdeLayout({\n  activityItems,\n  sidebar,\n  tabs,\n}: {\n  activityItems: string[];\n  sidebar: ReactNode;\n  tabs: PanelTab[];\n}) {\n  const [activeActivity, setActiveActivity] = useState(activityItems[0]);\n  const [sidebarOpen, setSidebarOpen] = useState(true);\n  const [activeTab, setActiveTab] = useState(tabs[0]?.id);\n  const [panelOpen, setPanelOpen] = useState(true);\n\n  const current = tabs.find((t) => t.id === activeTab) ?? tabs[0];\n\n  return (\n    <div className=\"ide-root\" data-sidebar={sidebarOpen ? \"open\" : \"closed\"}>\n      <nav className=\"ide-activity\" aria-label=\"Activity\">\n        {activityItems.map((item) => (\n          <button\n            key={item}\n            type=\"button\"\n            title={item}\n            onClick={() => {\n              setActiveActivity(item);\n              setSidebarOpen(item === activeActivity ? !sidebarOpen : true);\n            }}\n            className={item === activeActivity ? \"ide-activity-item is-active\" : \"ide-activity-item\"}\n          >\n            {item.slice(0, 2)}\n          </button>\n        ))}\n      </nav>\n\n      {sidebarOpen ? <aside className=\"ide-sidebar\">{sidebar}</aside> : null}\n\n      <main className=\"ide-editor\">\n        <div className=\"ide-tabs\" role=\"tablist\">\n          {tabs.map((t) => (\n            <button\n              key={t.id}\n              type=\"button\"\n              role=\"tab\"\n              aria-selected={t.id === activeTab}\n              onClick={() => setActiveTab(t.id)}\n              className={t.id === activeTab ? \"ide-tab is-active\" : \"ide-tab\"}\n            >\n              {t.label}\n            </button>\n          ))}\n        </div>\n        <div className=\"ide-surface\">{current?.content}</div>\n      </main>\n\n      <section className=\"ide-panel\" data-open={panelOpen}>\n        <button\n          type=\"button\"\n          className=\"ide-panel-toggle\"\n          onClick={() => setPanelOpen((v) => !v)}\n        >\n          {panelOpen ? \"▾ Output\" : \"▸ Output\"}\n        </button>\n        {panelOpen ? <pre className=\"ide-output\">ready — no errors</pre> : null}\n      </section>\n    </div>\n  );\n}",
  "cssRules": ".ide-root {\n  display: grid;\n  grid-template-columns: 48px 260px 1fr;\n  grid-template-rows: 1fr auto;\n  height: 100%;\n  min-height: 460px;\n  background: var(--surface-inset, #0b0d12);\n  color: var(--text-strong, #d5dae6);\n}\n.ide-root[data-sidebar=\"closed\"] {\n  grid-template-columns: 48px 0 1fr;\n}\n.ide-activity {\n  display: flex;\n  flex-direction: column;\n  gap: 4px;\n  padding: 8px 0;\n  background: var(--surface-base, #0e1116);\n  border-right: 1px solid var(--line-subtle, #1e2230);\n}\n.ide-activity-item {\n  height: 36px;\n  margin: 0 6px;\n  border: none;\n  border-radius: 6px;\n  background: transparent;\n  color: var(--text-muted, #7c8598);\n  font-size: 11px;\n  cursor: pointer;\n}\n.ide-activity-item.is-active {\n  background: var(--surface-raised, #171c26);\n  color: var(--text-strong, #ffffff);\n  box-shadow: inset 2px 0 0 var(--accent, #6366f1);\n}\n.ide-sidebar {\n  overflow-y: auto;\n  padding: 12px 10px;\n  font-size: 12px;\n  border-right: 1px solid var(--line-subtle, #1e2230);\n}\n.ide-editor {\n  display: flex;\n  flex-direction: column;\n  min-width: 0;\n  overflow: hidden;\n}\n.ide-tabs {\n  display: flex;\n  overflow-x: auto;\n  background: var(--surface-base, #0e1116);\n  border-bottom: 1px solid var(--line-subtle, #1e2230);\n}\n.ide-tab {\n  padding: 8px 14px;\n  font-size: 12px;\n  white-space: nowrap;\n  border: none;\n  border-right: 1px solid var(--line-subtle, #1e2230);\n  background: transparent;\n  color: var(--text-muted, #7c8598);\n  cursor: pointer;\n}\n.ide-tab.is-active {\n  background: var(--surface-inset, #0b0d12);\n  color: var(--text-strong, #ffffff);\n  box-shadow: inset 0 2px 0 var(--accent, #6366f1);\n}\n.ide-surface {\n  flex: 1;\n  overflow: auto;\n  padding: 20px;\n}\n.ide-panel {\n  grid-column: 1 / -1;\n  border-top: 1px solid var(--line-subtle, #1e2230);\n  background: var(--surface-base, #0e1116);\n}\n.ide-panel-toggle {\n  width: 100%;\n  text-align: left;\n  padding: 6px 12px;\n  font-size: 11px;\n  letter-spacing: 0.04em;\n  border: none;\n  background: transparent;\n  color: var(--text-muted, #7c8598);\n  cursor: pointer;\n}\n.ide-output {\n  margin: 0;\n  padding: 0 12px 12px;\n  font-family: ui-monospace, monospace;\n  font-size: 12px;\n  line-height: 1.6;\n  color: var(--text-muted, #93a0b8);\n  max-height: 160px;\n  overflow: auto;\n}",
  "usage": "用于代码编辑器、日志分析台与任何需要同时呈现导航／内容／输出的专业工具。",
  "targetStyles": ["swiss-dark", "retro-mac", "monochrome-research", "nordic-frost"],
  "updatedAt": "2026-10-04"
}
